candidate,family,exact_board_header,exact_cable_housing,exact_terminal_or_cable,wire,tooling,pitch_mm,latch,current_rating,mating_cycles,availability_status,drawing_footprint_status,decision
1,"Molex Micro-Lock Plus 2.0 single row","5055750620","5055700601","5055721200","Alpha Wire 422607 26 AWG stranded UL1061; 0.99 mm nominal OD","Molex 200218-4500 hand crimp tool",2.00,"positive lock and polarization","Signal use; family rating exceeds requirement; 26 AWG supported",30,"Manufacturer pages active/check availability","Manufacturer drawing and application specification available; future KiCad footprint remains VERIFY","SELECTED for three 6-circuit harness groups"
2,"JST GH","BM06B-GHS-TBT","GHR-06V-S","SSHL-002T-P0.2","26-30 AWG; 0.76-1.00 mm OD","JST YRS-1590 hand tool or WC-GH2630 applicator",1.25,"secure outer lock and keying","1 A at 26 AWG","Not stated on inspected product page","Manufacturer page and CAD active","Manufacturer 2D/3D data available; future footprint VERIFY","Qualified alternate; smaller but lower service robustness and tooling burden"
3,"TE Micro-MaTch Industrial","338068-6 female-on-board THT","215083-6 male-on-wire assembly","Integrated IDC contacts in 215083-6","28 AWG ribbon; 0.8-1.0 mm insulation OD","TE application specification 114-19016; low-volume exact tool not closed",1.27,"polarized; friction retention","1.5 A","Not closed from inspected page","TE marks parts active but page reports currently unavailable","Product drawings available; exact low-volume process and footprint VERIFY","REJECTED for this prototype because field tooling and availability are weaker"
4,"Harwin Gecko Latch","G125-MV11205L0P 12-contact board connector","G125-2041296L0 cable housing","G125-0010005 contacts or G125-FC11205L0-0100F 100 mm assembly","26 AWG on exact 100 mm cable assembly","Harwin Z125-900 tool plus Z125-901 positioner for loose contacts",1.25,"high-reliability latch family","2.8 A individual / 2 A simultaneous at 25 C",1000,"Manufacturer pages show stock-search/orderable family","Manufacturer drawings and CAD available; future footprint VERIFY","QUALIFIED but not selected; cost size and 12-contact grouping are excessive"
5,"Samtec I2SS/T2I","T2I-05-VT-T-S-TH","I2SS-05-24-T","Integrated IDC contacts","24 AWG discrete wire; 1.42 mm OD target","Standard flat-jaw pliers per Samtec",2.00,"single plastic latch","Signal family; exact current not used for decision","Not closed from inspected source","Configured parts in manufacturer Reserve program","Manufacturer print/footprint available","REJECTED because family stops at five positions and would fragment each six-wire group"
